<?xml version="1.0" encoding="UTF-8"?>
<xs:schema xmlns:xs="http://www.w3.org/2001/XMLSchema" elementFormDefault="qualified" attributeFormDefault="unqualified">
  <xs:element name="urlset">
    <xs:complexType>
      <xs:sequence>
        <xs:element name="url" maxOccurs="unbounded">
          <xs:complexType>
            <xs:sequence>
              <xs:element name="loc" type="xs:string"></xs:element>
              <xs:element name="lastmod" type="xs:dateTime"></xs:element>
              <xs:element name="priority" type="xs:int"></xs:element>
            </xs:sequence>
          </xs:complexType>
        </xs:element>
      </xs:sequence>
      <xs:attribute name="xmlns" type="xs:string"></xs:attribute>
      <xs:attribute name="xmlns:xsi" type="xs:string"></xs:attribute>
      <xs:attribute name="xsi:schemaLocation" type="xs:string"></xs:attribute>
    </xs:complexType>
  </xs:element>
</xs:schema>
